keyword,search_volume,difficulty,cpc,current_position
best project management software,12100,45,3.20,
project management tools for small teams,2400,32,2.10,15
free project management app,6600,38,1.80,
agile project management software,1900,41,3.50,8
how to manage projects effectively,1600,22,0.90,
project management methodology comparison,880,28,1.20,
kanban vs scrum for project management,1300,25,1.10,12
project management for remote teams,3100,35,2.80,
monday vs asana vs clickup,2200,48,4.20,
simple project management tool,1800,30,1.90,
project management software with time tracking,1400,33,2.40,
enterprise project management platform,950,52,5.10,
open source project management tools,2100,29,0.80,
project management app for freelancers,1100,24,1.60,
best free project management software 2026,4400,40,2.30,
project management with gantt charts,1700,35,2.50,
jira alternatives for small teams,1500,38,3.80,22
project management for marketing teams,890,27,2.90,
collaborative project management software,1200,36,2.70,
project management tool with client portal,650,22,3.10,
how to choose project management software,720,18,1.40,
project management software pricing comparison,980,42,3.90,
lightweight project management tool,800,20,1.50,
project management for startups,2600,30,2.60,
project management software with resource allocation,540,34,3.40,
best project management tools for developers,1900,37,2.80,
project management workflow automation,1100,39,3.20,
visual project management software,750,26,1.70,
task management vs project management,1400,19,0.70,
project management roi calculator,320,15,1.90,
